{
  "ir_version": "mechanism-ir-test/0.1",
  "fixture_id": "M2-beckmann-snake.v1",
  "title": "Beckmann Snake: phenyl-anti oxime, acid-water teaching model",
  "assumptions": [
    "Synthetic teaching pathway, not seven experimentally established intermediates.",
    "Phenyl atom 10 is anti to oxime oxygen 3 across C1=N2 in s0 and s1; no E/Z isomerization or side reactions are modelled.",
    "Hydronium and water are explicit; an unchanged spectator counterion is omitted; displayed system charge remains +1.",
    "Mapped water O21 is chosen to track this path only; no experimental isotope-source or proton-exchange claim.",
    "All arrows in each transition are simultaneous against its source state; resonance contributors are not separate time steps.",
    "Only carbon-bound non-transferred H may remain implicit; all transferred H are explicit mapped atoms."
  ],
  "atom_catalog": [
    {
      "map": 1,
      "element": "C",
      "implicit_h": 0
    },
    {
      "map": 2,
      "element": "N",
      "implicit_h": 0
    },
    {
      "map": 3,
      "element": "O",
      "implicit_h": 0
    },
    {
      "map": 4,
      "element": "C",
      "implicit_h": 3
    },
    {
      "map": 10,
      "element": "C",
      "implicit_h": 0
    },
    {
      "map": 11,
      "element": "C",
      "implicit_h": 1
    },
    {
      "map": 12,
      "element": "C",
      "implicit_h": 1
    },
    {
      "map": 13,
      "element": "C",
      "implicit_h": 1
    },
    {
      "map": 14,
      "element": "C",
      "implicit_h": 1
    },
    {
      "map": 15,
      "element": "C",
      "implicit_h": 1
    },
    {
      "map": 20,
      "element": "O",
      "implicit_h": 0
    },
    {
      "map": 21,
      "element": "O",
      "implicit_h": 0
    },
    {
      "map": 30,
      "element": "H",
      "implicit_h": 0
    },
    {
      "map": 31,
      "element": "H",
      "implicit_h": 0
    },
    {
      "map": 32,
      "element": "H",
      "implicit_h": 0
    },
    {
      "map": 33,
      "element": "H",
      "implicit_h": 0
    },
    {
      "map": 34,
      "element": "H",
      "implicit_h": 0
    },
    {
      "map": 35,
      "element": "H",
      "implicit_h": 0
    }
  ],
  "states": [
    {
      "id": "s0",
      "label": "Phenyl-anti acetophenone oxime",
      "formal_charges": [
        {
          "atom": 20,
          "value": 1
        }
      ],
      "lone_pairs": [
        {
          "atom": 2,
          "count": 1
        },
        {
          "atom": 3,
          "count": 2
        },
        {
          "atom": 20,
          "count": 1
        },
        {
          "atom": 21,
          "count": 2
        }
      ],
      "bonds": [
        {
          "atoms": [
            1,
            2
          ],
          "order": 2
        },
        {
          "atoms": [
            1,
            4
          ],
          "order": 1
        },
        {
          "atoms": [
            1,
            10
          ],
          "order": 1
        },
        {
          "atoms": [
            2,
            3
          ],
          "order": 1
        },
        {
          "atoms": [
            3,
            30
          ],
          "order": 1
        },
        {
          "atoms": [
            10,
            11
          ],
          "order": 1.5
        },
        {
          "atoms": [
            10,
            15
          ],
          "order": 1.5
        },
        {
          "atoms": [
            11,
            12
          ],
          "order": 1.5
        },
        {
          "atoms": [
            12,
            13
          ],
          "order": 1.5
        },
        {
          "atoms": [
            13,
            14
          ],
          "order": 1.5
        },
        {
          "atoms": [
            14,
            15
          ],
          "order": 1.5
        },
        {
          "atoms": [
            20,
            31
          ],
          "order": 1
        },
        {
          "atoms": [
            20,
            32
          ],
          "order": 1
        },
        {
          "atoms": [
            20,
            33
          ],
          "order": 1
        },
        {
          "atoms": [
            21,
            34
          ],
          "order": 1
        },
        {
          "atoms": [
            21,
            35
          ],
          "order": 1
        }
      ]
    },
    {
      "id": "s1",
      "label": "O-protonated oxime",
      "formal_charges": [
        {
          "atom": 3,
          "value": 1
        }
      ],
      "lone_pairs": [
        {
          "atom": 2,
          "count": 1
        },
        {
          "atom": 3,
          "count": 1
        },
        {
          "atom": 20,
          "count": 2
        },
        {
          "atom": 21,
          "count": 2
        }
      ],
      "bonds": [
        {
          "atoms": [
            1,
            2
          ],
          "order": 2
        },
        {
          "atoms": [
            1,
            4
          ],
          "order": 1
        },
        {
          "atoms": [
            1,
            10
          ],
          "order": 1
        },
        {
          "atoms": [
            2,
            3
          ],
          "order": 1
        },
        {
          "atoms": [
            3,
            30
          ],
          "order": 1
        },
        {
          "atoms": [
            3,
            31
          ],
          "order": 1
        },
        {
          "atoms": [
            10,
            11
          ],
          "order": 1.5
        },
        {
          "atoms": [
            10,
            15
          ],
          "order": 1.5
        },
        {
          "atoms": [
            11,
            12
          ],
          "order": 1.5
        },
        {
          "atoms": [
            12,
            13
          ],
          "order": 1.5
        },
        {
          "atoms": [
            13,
            14
          ],
          "order": 1.5
        },
        {
          "atoms": [
            14,
            15
          ],
          "order": 1.5
        },
        {
          "atoms": [
            20,
            32
          ],
          "order": 1
        },
        {
          "atoms": [
            20,
            33
          ],
          "order": 1
        },
        {
          "atoms": [
            21,
            34
          ],
          "order": 1
        },
        {
          "atoms": [
            21,
            35
          ],
          "order": 1
        }
      ]
    },
    {
      "id": "s2",
      "label": "Nitrilium after anti-phenyl migration",
      "formal_charges": [
        {
          "atom": 2,
          "value": 1
        }
      ],
      "lone_pairs": [
        {
          "atom": 2,
          "count": 0
        },
        {
          "atom": 3,
          "count": 2
        },
        {
          "atom": 20,
          "count": 2
        },
        {
          "atom": 21,
          "count": 2
        }
      ],
      "bonds": [
        {
          "atoms": [
            1,
            2
          ],
          "order": 3
        },
        {
          "atoms": [
            1,
            4
          ],
          "order": 1
        },
        {
          "atoms": [
            2,
            10
          ],
          "order": 1
        },
        {
          "atoms": [
            3,
            30
          ],
          "order": 1
        },
        {
          "atoms": [
            3,
            31
          ],
          "order": 1
        },
        {
          "atoms": [
            10,
            11
          ],
          "order": 1.5
        },
        {
          "atoms": [
            10,
            15
          ],
          "order": 1.5
        },
        {
          "atoms": [
            11,
            12
          ],
          "order": 1.5
        },
        {
          "atoms": [
            12,
            13
          ],
          "order": 1.5
        },
        {
          "atoms": [
            13,
            14
          ],
          "order": 1.5
        },
        {
          "atoms": [
            14,
            15
          ],
          "order": 1.5
        },
        {
          "atoms": [
            20,
            32
          ],
          "order": 1
        },
        {
          "atoms": [
            20,
            33
          ],
          "order": 1
        },
        {
          "atoms": [
            21,
            34
          ],
          "order": 1
        },
        {
          "atoms": [
            21,
            35
          ],
          "order": 1
        }
      ]
    },
    {
      "id": "s3",
      "label": "Water-added imidate oxonium",
      "formal_charges": [
        {
          "atom": 21,
          "value": 1
        }
      ],
      "lone_pairs": [
        {
          "atom": 2,
          "count": 1
        },
        {
          "atom": 3,
          "count": 2
        },
        {
          "atom": 20,
          "count": 2
        },
        {
          "atom": 21,
          "count": 1
        }
      ],
      "bonds": [
        {
          "atoms": [
            1,
            2
          ],
          "order": 2
        },
        {
          "atoms": [
            1,
            4
          ],
          "order": 1
        },
        {
          "atoms": [
            1,
            21
          ],
          "order": 1
        },
        {
          "atoms": [
            2,
            10
          ],
          "order": 1
        },
        {
          "atoms": [
            3,
            30
          ],
          "order": 1
        },
        {
          "atoms": [
            3,
            31
          ],
          "order": 1
        },
        {
          "atoms": [
            10,
            11
          ],
          "order": 1.5
        },
        {
          "atoms": [
            10,